[
  {
    "oppgaveID": "1",
    "oppgavetype": {
      "kode": "BEH_SAK",
      "term": "Behandling"
    },
    "sammensattNavn": "LILLA HEST",
    "saksnummer": "3",
    "aktivTil": "2019-04-25",
    "soknadsperiode": {
      "fom": null,
      "tom": null
    },
    "sakstype": {
      "kode": "EU_EOS",
      "term": "EU/EØS"
    },
    "behandling": {
      "behandlingID": null,
      "behandlingType": {
        "kode": "SKND",
        "term": "Søknad"
      },
      "behandlingStatus": {
        "kode": "OPPR",
        "term": "Opprettet"
      },
      "endretDato": null
    },
    "land": [
      "GB"
    ],
    "journalpostID": null,
    "prioritet": "HOY",
    "versjon": 1,
    "ansvarligID": "Z991001"
  },
  {
    "oppgaveID": "2",
    "oppgavetype": {
      "kode": "BEH_SAK",
      "term": "Behandling"
    },
    "sammensattNavn": "LILLA HEST",
    "saksnummer": "3",
    "aktivTil": "2019-04-25",
    "soknadsperiode": {
      "fom": null,
      "tom": null
    },
    "sakstype": {
      "kode": "EU_EOS",
      "term": "EU/EØS"
    },
    "behandling": {
      "behandlingID": null,
      "behandlingType": {
        "kode": "SKND",
        "term": "Søknad"
      },
      "behandlingStatus": {
        "kode": "OPPR",
        "term": "Opprettet"
      },
      "endretDato": null
    },
    "land": [
      "GB"
    ],
    "journalpostID": null,
    "prioritet": "HOY",
    "ansvarligID": "Z991001",
    "versjon": 1
  },
  {
    "oppgaveID": "3",
    "oppgavetype": {
      "kode": "JFR",
      "term": "Journalføring"
    },
    "journalpostID": "DOK_3789",
    "aktivTil": "2019-04-25",
    "sammensattNavn": null,
    "saksnummer": null,
    "soknadsperiode": {
      "fom": null,
      "tom": null
    },
    "sakstype": null,
    "behandling": {
      "behandlingID": null,
      "behandlingStatus": null,
      "behandlingType": null,
      "endretDato": null
    },
    "prioritet": "HOY",
    "land": null,
    "versjon": 1,
    "ansvarligID": "Z991001"
  },
  {
    "oppgaveID": "4",
    "oppgavetype": {
      "kode": "JFR",
      "term": "Journalføring"
    },
    "journalpostID": "DOK_4987",
    "aktivTil": "2019-04-25",
    "sammensattNavn": null,
    "saksnummer": null,
    "soknadsperiode": {
      "fom": null,
      "tom": null
    },
    "sakstype": null,
    "behandling": {
      "behandlingID": null,
      "behandlingType": null,
      "behandlingStatus": null,
      "endretDato": null
    },
    "prioritet": "HOY",
    "land": null,
    "versjon": 1,
    "ansvarligID": "Z991001"
  },
  {
    "oppgaveID": "5",
    "oppgavetype": {
      "kode": "JFR",
      "term": "Journalføring"
    },
    "journalpostID": "DOK_5678",
    "aktivTil": "2019-04-25",
    "sammensattNavn": null,
    "saksnummer": null,
    "soknadsperiode": {
      "fom": null,
      "tom": null
    },
    "sakstype": null,
    "behandling": {
      "behandlingID": null,
      "behandlingType": null,
      "behandlingStatus": null,
      "endretDato": null
    },
    "prioritet": "HOY",
    "land": null,
    "versjon": 1,
    "ansvarligID": "Z991001"
  },
  {
    "oppgaveID": "6",
    "oppgavetype": {
      "kode": "BEH_SAK",
      "term": "Behandling"
    },
    "sammensattNavn": "LILLA HEST",
    "saksnummer": "3",
    "aktivTil": "2019-04-25",
    "soknadsperiode": {
      "fom": null,
      "tom": null
    },
    "sakstype": {
      "kode": "EU_EOS",
      "term": "EU/EØS"
    },
    "behandling": {
      "behandlingID": null,
      "behandlingType": {
        "kode": "SKND",
        "term": "Søknad"
      },
      "behandlingStatus": {
        "kode": "OPPR",
        "term": "Opprettet"
      },
      "endretDato": null
    },
    "land": [
      "GB"
    ],
    "journalpostID": null,
    "prioritet": "HOY",
    "versjon": 1,
    "ansvarligID": "Z991001"
  }
]
